name	version	authors	repository	license	license_file	description
adler2	2.0.1	Jonas Schievink <jonasschievink@gmail.com>|oyvindln <oyvindln@users.noreply.github.com>	https://github.com/oyvindln/adler2	0BSD OR Apache-2.0 OR MIT		A simple clean-room implementation of the Adler-32 checksum
aho-corasick	1.1.4	Andrew Gallant <jamslam@gmail.com>	https://github.com/BurntSushi/aho-corasick	MIT OR Unlicense		Fast multiple substring searching.
alloc-no-stdlib	2.0.4	Daniel Reiter Horn <danielrh@dropbox.com>	https://github.com/dropbox/rust-alloc-no-stdlib	BSD-3-Clause		A dynamic allocator that may be used with or without the stdlib. This allows a package with nostd to allocate memory dynamically and be used either with a custom allocator, items on the stack, or by a package that wishes to simply use Box<>. It also provides options to use calloc or a mutable global variable for pre-zeroed memory
alloc-stdlib	0.2.2	Daniel Reiter Horn <danielrh@dropbox.com>	https://github.com/dropbox/rust-alloc-no-stdlib	BSD-3-Clause		A dynamic allocator example that may be used with the stdlib
android_system_properties	0.1.5	Nicolas Silva <nical@fastmail.com>	https://github.com/nical/android_system_properties	Apache-2.0 OR MIT		Minimal Android system properties wrapper
anyhow	1.0.100	David Tolnay <dtolnay@gmail.com>	https://github.com/dtolnay/anyhow	Apache-2.0 OR MIT		Flexible concrete Error type built on std::error::Error
atk	0.18.2	The gtk-rs Project Developers	https://github.com/gtk-rs/gtk3-rs	MIT		UNMAINTAINED Rust bindings for the ATK library
atk-sys	0.18.2	The gtk-rs Project Developers	https://github.com/gtk-rs/gtk3-rs	MIT		UNMAINTAINED FFI bindings to libatk-1
atomic-waker	1.1.2	Stjepan Glavina <stjepang@gmail.com>|Contributors to futures-rs	https://github.com/smol-rs/atomic-waker	Apache-2.0 OR MIT		A synchronization primitive for task wakeup
autocfg	1.5.0	Josh Stone <cuviper@gmail.com>	https://github.com/cuviper/autocfg	Apache-2.0 OR MIT		Automatic cfg for Rust compiler features
base64	0.21.7	Alice Maz <alice@alicemaz.com>|Marshall Pierce <marshall@mpierce.org>	https://github.com/marshallpierce/rust-base64	Apache-2.0 OR MIT		encodes and decodes base64 as bytes or utf8
base64	0.22.1	Marshall Pierce <marshall@mpierce.org>	https://github.com/marshallpierce/rust-base64	Apache-2.0 OR MIT		encodes and decodes base64 as bytes or utf8
bitflags	1.3.2	The Rust Project Developers	https://github.com/bitflags/bitflags	Apache-2.0 OR MIT		A macro to generate structures which behave like bitflags.
bitflags	2.10.0	The Rust Project Developers	https://github.com/bitflags/bitflags	Apache-2.0 OR MIT		A macro to generate structures which behave like bitflags.
block-buffer	0.10.4	RustCrypto Developers	https://github.com/RustCrypto/utils	Apache-2.0 OR MIT		Buffer type for block processing of data
block2	0.6.2	Mads Marquart <mads@marquart.dk>	https://github.com/madsmtm/objc2	MIT		Apple's C language extension of blocks
brotli	8.0.2	Daniel Reiter Horn <danielrh@dropbox.com>|The Brotli Authors	https://github.com/dropbox/rust-brotli	BSD-3-Clause AND MIT		A brotli compressor and decompressor that with an interface avoiding the rust stdlib. This makes it suitable for embedded devices and kernels. It is designed with a pluggable allocator so that the standard lib's allocator may be employed. The default build also includes a stdlib allocator and stream interface. Disable this with --features=no-stdlib. All included code is safe.
brotli-decompressor	5.0.0	Daniel Reiter Horn <danielrh@dropbox.com>|The Brotli Authors	https://github.com/dropbox/rust-brotli-decompressor	BSD-3-Clause OR MIT		A brotli decompressor that with an interface avoiding the rust stdlib. This makes it suitable for embedded devices and kernels. It is designed with a pluggable allocator so that the standard lib's allocator may be employed. The default build also includes a stdlib allocator and stream interface. Disable this with --features=no-stdlib. Alternatively, --features=unsafe turns off array bounds checks and memory initialization but provides a safe interface for the caller.  Without adding the --features=unsafe argument, all included code is safe. For compression in addition to this library, download https://github.com/dropbox/rust-brotli
bumpalo	3.19.0	Nick Fitzgerald <fitzgen@gmail.com>	https://github.com/fitzgen/bumpalo	Apache-2.0 OR MIT		A fast bump allocation arena for Rust.
bytemuck	1.24.0	Lokathor <zefria@gmail.com>	https://github.com/Lokathor/bytemuck	Apache-2.0 OR MIT OR Zlib		A crate for mucking around with piles of bytes.
byteorder	1.5.0	Andrew Gallant <jamslam@gmail.com>	https://github.com/BurntSushi/byteorder	MIT OR Unlicense		Library for reading/writing numbers in big-endian and little-endian.
bytes	1.11.0	Carl Lerche <me@carllerche.com>|Sean McArthur <sean@seanmonstar.com>	https://github.com/tokio-rs/bytes	MIT		Types and traits for working with bytes
cairo-rs	0.18.5	The gtk-rs Project Developers	https://github.com/gtk-rs/gtk-rs-core	MIT		Rust bindings for the Cairo library
cairo-sys-rs	0.18.2	The gtk-rs Project Developers	https://github.com/gtk-rs/gtk-rs-core	MIT		FFI bindings to libcairo
camino	1.2.2	Without Boats <saoirse@without.boats>|Ashley Williams <ashley666ashley@gmail.com>|Steve Klabnik <steve@steveklabnik.com>|Rain <rain@sunshowers.io>	https://github.com/camino-rs/camino	Apache-2.0 OR MIT		UTF-8 paths
cargo-platform	0.1.9		https://github.com/rust-lang/cargo	Apache-2.0 OR MIT		Cargo's representation of a target platform.
cargo_metadata	0.19.2	Oliver Schneider <git-spam-no-reply9815368754983@oli-obk.de>	https://github.com/oli-obk/cargo_metadata	MIT		structured access to the output of `cargo metadata`
cargo_toml	0.22.3	Kornel <kornel@geekhood.net>	https://gitlab.com/lib.rs/cargo_toml	Apache-2.0 OR MIT		`Cargo.toml` struct definitions for parsing with Serde
cc	1.2.49	Alex Crichton <alex@alexcrichton.com>	https://github.com/rust-lang/cc-rs	Apache-2.0 OR MIT		A build-time dependency for Cargo build scripts to assist in invoking the native C compiler to compile native C code into a static archive to be linked into Rust code.
cesu8	1.1.0	Eric Kidd <git@randomhacks.net>	https://github.com/emk/cesu8-rs	Apache-2.0 OR MIT		Convert to and from CESU-8 encoding (similar to UTF-8)
cfb	0.7.3	Matthew D. Steele <mdsteele@alum.mit.edu>	https://github.com/mdsteele/rust-cfb	MIT		Read/write Compound File Binary (structured storage) files
cfg-expr	0.15.8	Embark <opensource@embark-studios.com>|Jake Shadle <jake.shadle@embark-studios.com>	https://github.com/EmbarkStudios/cfg-expr	Apache-2.0 OR MIT		A parser and evaluator for Rust `cfg()` expressions.
cfg-if	1.0.4	Alex Crichton <alex@alexcrichton.com>	https://github.com/rust-lang/cfg-if	Apache-2.0 OR MIT		A macro to ergonomically define an item depending on a large number of #[cfg] parameters. Structured like an if-else chain, the first matching branch is the item that gets emitted.
chrono	0.4.42		https://github.com/chronotope/chrono	Apache-2.0 OR MIT		Date and time library for Rust
combine	4.6.7	Markus Westerlind <marwes91@gmail.com>	https://github.com/Marwes/combine	MIT		Fast parser combinators on arbitrary streams with zero-copy support.
convert_case	0.4.0	David Purdum <purdum41@gmail.com>	https://github.com/rutrum/convert-case	MIT		Convert strings into any case
cookie	0.18.1	Sergio Benitez <sb@sergio.bz>|Alex Crichton <alex@alexcrichton.com>	https://github.com/SergioBenitez/cookie-rs	Apache-2.0 OR MIT		HTTP cookie parsing and cookie jar management. Supports signed and private (encrypted, authenticated) jars.
core-foundation	0.10.1	The Servo Project Developers	https://github.com/servo/core-foundation-rs	Apache-2.0 OR MIT		Bindings to Core Foundation for macOS
core-foundation-sys	0.8.7	The Servo Project Developers	https://github.com/servo/core-foundation-rs	Apache-2.0 OR MIT		Bindings to Core Foundation for macOS
core-graphics	0.24.0	The Servo Project Developers	https://github.com/servo/core-foundation-rs	Apache-2.0 OR MIT		Bindings to Core Graphics for macOS
core-graphics-types	0.2.0	The Servo Project Developers	https://github.com/servo/core-foundation-rs	Apache-2.0 OR MIT		Bindings for some fundamental Core Graphics types
cpufeatures	0.2.17	RustCrypto Developers	https://github.com/RustCrypto/utils	Apache-2.0 OR MIT		Lightweight runtime CPU feature detection for aarch64, loongarch64, and x86/x86_64 targets,  with no_std support and support for mobile targets including Android and iOS
crc32fast	1.5.0	Sam Rijs <srijs@airpost.net>|Alex Crichton <alex@alexcrichton.com>	https://github.com/srijs/rust-crc32fast	Apache-2.0 OR MIT		Fast, SIMD-accelerated CRC32 (IEEE) checksum computation
crossbeam-channel	0.5.15		https://github.com/crossbeam-rs/crossbeam	Apache-2.0 OR MIT		Multi-producer multi-consumer channels for message passing
crossbeam-utils	0.8.21		https://github.com/crossbeam-rs/crossbeam	Apache-2.0 OR MIT		Utilities for concurrent programming
crypto-common	0.1.7	RustCrypto Developers	https://github.com/RustCrypto/traits	Apache-2.0 OR MIT		Common cryptographic traits
cssparser	0.29.6	Simon Sapin <simon.sapin@exyr.org>	https://github.com/servo/rust-cssparser	MPL-2.0		Rust implementation of CSS Syntax Level 3
cssparser-macros	0.6.1	Simon Sapin <simon.sapin@exyr.org>	https://github.com/servo/rust-cssparser	MPL-2.0		Procedural macros for cssparser
ctor	0.2.9	Matt Mastracci <matthew@mastracci.com>	https://github.com/mmastrac/rust-ctor	Apache-2.0 OR MIT		__attribute__((constructor)) for Rust
darling	0.21.3	Ted Driggs <ted.driggs@outlook.com>	https://github.com/TedDriggs/darling	MIT		A proc-macro library for reading attributes into structs when implementing custom derives.
darling_core	0.21.3	Ted Driggs <ted.driggs@outlook.com>	https://github.com/TedDriggs/darling	MIT		Helper crate for proc-macro library for reading attributes into structs when implementing custom derives. Use https://crates.io/crates/darling in your code.
darling_macro	0.21.3	Ted Driggs <ted.driggs@outlook.com>	https://github.com/TedDriggs/darling	MIT		Internal support for a proc-macro library for reading attributes into structs when implementing custom derives. Use https://crates.io/crates/darling in your code.
deranged	0.5.5	Jacob Pratt <jacob@jhpratt.dev>	https://github.com/jhpratt/deranged	Apache-2.0 OR MIT		Ranged integers
derive_more	0.99.20	Jelte Fennema <github-tech@jeltef.nl>	https://github.com/JelteF/derive_more	MIT		Adds #[derive(x)] macros for more traits
digest	0.10.7	RustCrypto Developers	https://github.com/RustCrypto/traits	Apache-2.0 OR MIT		Traits for cryptographic hash functions and message authentication codes
dirs	6.0.0	Simon Ochsenreither <simon@ochsenreither.de>	https://github.com/soc/dirs-rs	Apache-2.0 OR MIT		A tiny low-level library that provides platform-specific standard locations of directories for config, cache and other data on Linux, Windows, macOS and Redox by leveraging the mechanisms defined by the XDG base/user directory specifications on Linux, the Known Folder API on Windows, and the Standard Directory guidelines on macOS.
dirs-sys	0.5.0	Simon Ochsenreither <simon@ochsenreither.de>	https://github.com/dirs-dev/dirs-sys-rs	Apache-2.0 OR MIT		System-level helper functions for the dirs and directories crates.
dispatch	0.2.0	Steven Sheldon	http://github.com/SSheldon/rust-dispatch	MIT		Rust wrapper for Apple's Grand Central Dispatch.
dispatch2	0.3.0	Mads Marquart <mads@marquart.dk>|Mary <mary@mary.zone>	https://github.com/madsmtm/objc2	Apache-2.0 OR MIT OR Zlib		Bindings and wrappers for Apple's Grand Central Dispatch (GCD)
displaydoc	0.2.5	Jane Lusby <jlusby@yaah.dev>	https://github.com/yaahc/displaydoc	Apache-2.0 OR MIT		A derive macro for implementing the display Trait via a doc comment and string interpolation
dlopen2	0.8.2	Szymon Wieloch <szymon.wieloch@gmail.com>|Ahmed Masud <ahmed.masud@saf.ai>|OpenByte <development.openbyte@gmail.com>	https://github.com/OpenByteDev/dlopen2	MIT		Library for opening and operating on dynamic link libraries (also known as shared objects or shared libraries).
dlopen2_derive	0.4.3	Szymon Wieloch <szymon.wieloch@gmail.com>|OpenByte <development.openbyte@gmail.com>	https://github.com/OpenByteDev/dlopen2	MIT		Derive macros for the dlopen2 crate.
dpi	0.1.2		https://github.com/rust-windowing/winit	Apache-2.0 AND MIT		Types for handling UI scaling
dtoa	1.0.10	David Tolnay <dtolnay@gmail.com>	https://github.com/dtolnay/dtoa	Apache-2.0 OR MIT		Fast floating point primitive to string conversion
dtoa-short	0.3.5	Xidorn Quan <me@upsuper.org>	https://github.com/upsuper/dtoa-short	MPL-2.0		Serialize float number and truncate to certain precision
dunce	1.0.5	Kornel <kornel@geekhood.net>	https://gitlab.com/kornelski/dunce	Apache-2.0 OR CC0-1.0 OR MIT-0		Normalize Windows paths to the most compatible format, avoiding UNC where possible
dyn-clone	1.0.20	David Tolnay <dtolnay@gmail.com>	https://github.com/dtolnay/dyn-clone	Apache-2.0 OR MIT		Clone trait that is dyn-compatible
embed-resource	3.0.6	наб <nabijaczleweli@nabijaczleweli.xyz>|Cat Plus Plus <piotrlegnica@piotrl.pl>|Liigo <liigo@qq.com>|azyobuzin <azyobuzin@users.sourceforge.jp>|Peter Atashian <retep998@gmail.com>|pravic <ehysta@gmail.com>|Gabriel Majeri <gabriel.majeri6@gmail.com>|SonnyX|Johan Andersson <repi@repi.se>|Jordan Poles <jpdev.noreply@gmail.com>|MSxDOS <melcodos@gmail.com>|Jim McGrath <jimmc2@gmail.com>|roblabla <unfiltered@roblab.la>|Jasper Bekkers <jasper@traverseresearch.nl>|Richard Markiewicz <rmarkiewicz@devolutions.net>|Emerson de Freitas Barcelos <emersonfxbx@gmail.com>|Li Keqing <me@kaze.ai>|Alexis Bourget <alexis.bourget@gmail.com>|Michael Farrell <micolous+git@gmail.com>|Jacob Okamoto <oko@oko.io>|Marijn Suijten <marijn@traverseresearch.nl>|Lucas Nogueira <lucas@tauri.app>|CharlesChen0823 <yongchen0823@gmail.com>|Daniel Schaefer <dhs@frame.work>|Rene Leonhardt|ssrlive	https://github.com/nabijaczleweli/rust-embed-resource	MIT		A Cargo library to handle compilation and inclusion of Windows resources in the most resilient fashion imaginable
embed_plist	1.2.2	Nikolai Vazquez <hello@nikolaivazquez.com>	https://github.com/nvzqz/embed-plist-rs	Apache-2.0 OR MIT		Embed property list files like Info.plist directly in your executable binary.
equivalent	1.0.2		https://github.com/indexmap-rs/equivalent	Apache-2.0 OR MIT		Traits for key comparison in maps.
erased-serde	0.4.9	David Tolnay <dtolnay@gmail.com>	https://github.com/dtolnay/erased-serde	Apache-2.0 OR MIT		Type-erased Serialize and Serializer traits
fdeflate	0.3.7	The image-rs Developers	https://github.com/image-rs/fdeflate	Apache-2.0 OR MIT		Fast specialized deflate implementation
field-offset	0.3.6	Diggory Blake <diggsey@googlemail.com>	https://github.com/Diggsey/rust-field-offset	Apache-2.0 OR MIT		Safe pointer-to-member implementation
find-msvc-tools	0.1.5		https://github.com/rust-lang/cc-rs	Apache-2.0 OR MIT		Find windows-specific tools, read MSVC versions from the registry and from COM interfaces
flate2	1.1.5	Alex Crichton <alex@alexcrichton.com>|Josh Triplett <josh@joshtriplett.org>	https://github.com/rust-lang/flate2-rs	Apache-2.0 OR MIT		DEFLATE compression and decompression exposed as Read/BufRead/Write streams. Supports miniz_oxide and multiple zlib implementations. Supports zlib, gzip, and raw deflate streams.
fnv	1.0.7	Alex Crichton <alex@alexcrichton.com>	https://github.com/servo/rust-fnv	Apache-2.0 OR MIT		Fowler–Noll–Vo hash function
foreign-types	0.5.0	Steven Fackler <sfackler@gmail.com>	https://github.com/sfackler/foreign-types	Apache-2.0 OR MIT		A framework for Rust wrappers over C APIs
foreign-types-macros	0.2.3	Steven Fackler <sfackler@gmail.com>	https://github.com/sfackler/foreign-types	Apache-2.0 OR MIT		An internal crate used by foreign-types
foreign-types-shared	0.3.1	Steven Fackler <sfackler@gmail.com>	https://github.com/sfackler/foreign-types	Apache-2.0 OR MIT		An internal crate used by foreign-types
form_urlencoded	1.2.2	The rust-url developers	https://github.com/servo/rust-url	Apache-2.0 OR MIT		Parser and serializer for the application/x-www-form-urlencoded syntax, as used by HTML forms.
futf	0.1.5	Keegan McAllister <kmcallister@mozilla.com>	https://github.com/servo/futf	Apache-2.0 OR MIT		Handling fragments of UTF-8
futures-channel	0.3.31		https://github.com/rust-lang/futures-rs	Apache-2.0 OR MIT		Channels for asynchronous communication using futures-rs.
futures-core	0.3.31		https://github.com/rust-lang/futures-rs	Apache-2.0 OR MIT		The core traits and types in for the `futures` library.
futures-executor	0.3.31		https://github.com/rust-lang/futures-rs	Apache-2.0 OR MIT		Executors for asynchronous tasks based on the futures-rs library.
futures-io	0.3.31		https://github.com/rust-lang/futures-rs	Apache-2.0 OR MIT		The `AsyncRead`, `AsyncWrite`, `AsyncSeek`, and `AsyncBufRead` traits for the futures-rs library.
futures-macro	0.3.31		https://github.com/rust-lang/futures-rs	Apache-2.0 OR MIT		The futures-rs procedural macro implementations.
futures-sink	0.3.31		https://github.com/rust-lang/futures-rs	Apache-2.0 OR MIT		The asynchronous `Sink` trait for the futures-rs library.
futures-task	0.3.31		https://github.com/rust-lang/futures-rs	Apache-2.0 OR MIT		Tools for working with tasks.
futures-util	0.3.31		https://github.com/rust-lang/futures-rs	Apache-2.0 OR MIT		Common utilities and extension traits for the futures-rs library.
fxhash	0.2.1	cbreeden <github@u.breeden.cc>	https://github.com/cbreeden/fxhash	Apache-2.0 OR MIT		A fast, non-secure, hashing algorithm derived from an internal hasher used in FireFox and Rustc.
gdk	0.18.2	The gtk-rs Project Developers	https://github.com/gtk-rs/gtk3-rs	MIT		UNMAINTAINED Rust bindings for the GDK 3 library (use gdk4 instead)
gdk-pixbuf	0.18.5	The gtk-rs Project Developers	https://github.com/gtk-rs/gtk-rs-core	MIT		Rust bindings for the GdkPixbuf library
gdk-pixbuf-sys	0.18.0	The gtk-rs Project Developers	https://github.com/gtk-rs/gtk-rs-core	MIT		FFI bindings to libgdk_pixbuf-2.0
gdk-sys	0.18.2	The gtk-rs Project Developers	https://github.com/gtk-rs/gtk3-rs	MIT		UNMAINTAINED FFI bindings to libgdk-3 (use gdk4-sys instead)
gdkwayland-sys	0.18.2	The gtk-rs Project Developers	https://github.com/gtk-rs/gtk3-rs	MIT		UNMAINTAINED FFI bindings to libgdk-3-wayland (use gdk4-wayland-sys instead)
gdkx11	0.18.2	The gtk-rs Project Developers	https://github.com/gtk-rs/gtk3-rs	MIT		UNMAINTAINED Rust bindings for the GDK X11 library (use gdk4-x11 instead)
gdkx11-sys	0.18.2	The gtk-rs Project Developers	https://github.com/gtk-rs/gtk3-rs	MIT		UNMAINTAINED FFI binding for libgdkx11 (use gdk4-x11-sys instead)
generic-array	0.14.7	Bartłomiej Kamiński <fizyk20@gmail.com>|Aaron Trent <novacrazy@gmail.com>	https://github.com/fizyk20/generic-array.git	MIT		Generic types implementing functionality of arrays
getrandom	0.1.16	The Rand Project Developers	https://github.com/rust-random/getrandom	Apache-2.0 OR MIT		A small cross-platform library for retrieving random data from system source
getrandom	0.2.16	The Rand Project Developers	https://github.com/rust-random/getrandom	Apache-2.0 OR MIT		A small cross-platform library for retrieving random data from system source
getrandom	0.3.4	The Rand Project Developers	https://github.com/rust-random/getrandom	Apache-2.0 OR MIT		A small cross-platform library for retrieving random data from system source
gio	0.18.4	The gtk-rs Project Developers	https://github.com/gtk-rs/gtk-rs-core	MIT		Rust bindings for the Gio library
gio-sys	0.18.1	The gtk-rs Project Developers	https://github.com/gtk-rs/gtk-rs-core	MIT		FFI bindings to libgio-2.0
glib	0.18.5	The gtk-rs Project Developers	https://github.com/gtk-rs/gtk-rs-core	MIT		Rust bindings for the GLib library
glib-macros	0.18.5	The gtk-rs Project Developers	https://github.com/gtk-rs/gtk-rs-core	MIT		Rust bindings for the GLib library, proc macros crate
glib-sys	0.18.1	The gtk-rs Project Developers	https://github.com/gtk-rs/gtk-rs-core	MIT		FFI bindings to libglib-2.0
glob	0.3.3	The Rust Project Developers	https://github.com/rust-lang/glob	Apache-2.0 OR MIT		Support for matching file paths against Unix shell style patterns.
gobject-sys	0.18.0	The gtk-rs Project Developers	https://github.com/gtk-rs/gtk-rs-core	MIT		FFI bindings to libgobject-2.0
gtk	0.18.2	The gtk-rs Project Developers	https://github.com/gtk-rs/gtk3-rs	MIT		UNMAINTAINED Rust bindings for the GTK+ 3 library (use gtk4 instead)
gtk-sys	0.18.2	The gtk-rs Project Developers	https://github.com/gtk-rs/gtk3-rs	MIT		UNMAINTAINED FFI bindings to libgtk-3 (use gtk4-sys instead)
gtk3-macros	0.18.2	The gtk-rs Project Developers	https://github.com/gtk-rs/gtk3-rs	MIT		UNMAINTAINED Rust bindings for the GTK 3 library (use gtk4-macros instead)
hashbrown	0.12.3	Amanieu d'Antras <amanieu@gmail.com>	https://github.com/rust-lang/hashbrown	Apache-2.0 OR MIT		A Rust port of Google's SwissTable hash map
hashbrown	0.16.1	Amanieu d'Antras <amanieu@gmail.com>	https://github.com/rust-lang/hashbrown	Apache-2.0 OR MIT		A Rust port of Google's SwissTable hash map
heck	0.4.1	Without Boats <woboats@gmail.com>	https://github.com/withoutboats/heck	Apache-2.0 OR MIT		heck is a case conversion library.
heck	0.5.0		https://github.com/withoutboats/heck	Apache-2.0 OR MIT		heck is a case conversion library.
hex	0.4.3	KokaKiwi <kokakiwi@kokakiwi.net>	https://github.com/KokaKiwi/rust-hex	Apache-2.0 OR MIT		Encoding and decoding data into/from hexadecimal representation.
html5ever	0.29.1	The html5ever Project Developers	https://github.com/servo/html5ever	Apache-2.0 OR MIT		High-performance browser-grade HTML5 parser
http	1.4.0	Alex Crichton <alex@alexcrichton.com>|Carl Lerche <me@carllerche.com>|Sean McArthur <sean@seanmonstar.com>	https://github.com/hyperium/http	Apache-2.0 OR MIT		A set of types for representing HTTP requests and responses.
http-body	1.0.1	Carl Lerche <me@carllerche.com>|Lucio Franco <luciofranco14@gmail.com>|Sean McArthur <sean@seanmonstar.com>	https://github.com/hyperium/http-body	MIT		Trait representing an asynchronous, streaming, HTTP request or response body.
http-body-util	0.1.3	Carl Lerche <me@carllerche.com>|Lucio Franco <luciofranco14@gmail.com>|Sean McArthur <sean@seanmonstar.com>	https://github.com/hyperium/http-body	MIT		Combinators and adapters for HTTP request or response bodies.
httparse	1.10.1	Sean McArthur <sean@seanmonstar.com>	https://github.com/seanmonstar/httparse	Apache-2.0 OR MIT		A tiny, safe, speedy, zero-copy HTTP/1.x parser.
hyper	1.8.1	Sean McArthur <sean@seanmonstar.com>	https://github.com/hyperium/hyper	MIT		A protective and efficient HTTP library for all.
hyper-util	0.1.19	Sean McArthur <sean@seanmonstar.com>	https://github.com/hyperium/hyper-util	MIT		hyper utilities
iana-time-zone	0.1.64	Andrew Straw <strawman@astraw.com>|René Kijewski <rene.kijewski@fu-berlin.de>|Ryan Lopopolo <rjl@hyperbo.la>	https://github.com/strawlab/iana-time-zone	Apache-2.0 OR MIT		get the IANA time zone for the current system
iana-time-zone-haiku	0.1.2	René Kijewski <crates.io@k6i.de>	https://github.com/strawlab/iana-time-zone	Apache-2.0 OR MIT		iana-time-zone support crate for Haiku OS
ico	0.4.0	Matthew D. Steele <mdsteele@alum.mit.edu>	https://github.com/mdsteele/rust-ico	MIT		A library for encoding/decoding ICO image files
icu_collections	2.1.1	The ICU4X Project Developers	https://github.com/unicode-org/icu4x	Unicode-3.0		Collection of API for use in ICU libraries.
icu_locale_core	2.1.1	The ICU4X Project Developers	https://github.com/unicode-org/icu4x	Unicode-3.0		API for managing Unicode Language and Locale Identifiers
icu_normalizer	2.1.1	The ICU4X Project Developers	https://github.com/unicode-org/icu4x	Unicode-3.0		API for normalizing text into Unicode Normalization Forms
icu_normalizer_data	2.1.1	The ICU4X Project Developers	https://github.com/unicode-org/icu4x	Unicode-3.0		Data for the icu_normalizer crate
icu_properties	2.1.2	The ICU4X Project Developers	https://github.com/unicode-org/icu4x	Unicode-3.0		Definitions for Unicode properties
icu_properties_data	2.1.2	The ICU4X Project Developers	https://github.com/unicode-org/icu4x	Unicode-3.0		Data for the icu_properties crate
icu_provider	2.1.1	The ICU4X Project Developers	https://github.com/unicode-org/icu4x	Unicode-3.0		Trait and struct definitions for the ICU data provider
ident_case	1.0.1	Ted Driggs <ted.driggs@outlook.com>	https://github.com/TedDriggs/ident_case	Apache-2.0 OR MIT		Utility for applying case rules to Rust identifiers.
idna	1.1.0	The rust-url developers	https://github.com/servo/rust-url/	Apache-2.0 OR MIT		IDNA (Internationalizing Domain Names in Applications) and Punycode.
idna_adapter	1.2.1	The rust-url developers	https://github.com/hsivonen/idna_adapter	Apache-2.0 OR MIT		Back end adapter for idna
indexmap	1.9.3		https://github.com/bluss/indexmap	Apache-2.0 OR MIT		A hash table with consistent order and fast iteration.
indexmap	2.12.1		https://github.com/indexmap-rs/indexmap	Apache-2.0 OR MIT		A hash table with consistent order and fast iteration.
infer	0.19.0	Bojan <dbojan@gmail.com>	https://github.com/bojand/infer	MIT		Small crate to infer file type based on magic number signatures
ipnet	2.11.0	Kris Price <kris@krisprice.nz>	https://github.com/krisprice/ipnet	Apache-2.0 OR MIT		Provides types and useful methods for working with IPv4 and IPv6 network addresses, commonly called IP prefixes. The new `IpNet`, `Ipv4Net`, and `Ipv6Net` types build on the existing `IpAddr`, `Ipv4Addr`, and `Ipv6Addr` types already provided in Rust's standard library and align to their design to stay consistent. The module also provides useful traits that extend `Ipv4Addr` and `Ipv6Addr` with methods for `Add`, `Sub`, `BitAnd`, and `BitOr` operations. The module only uses stable feature so it is guaranteed to compile using the stable toolchain.
iri-string	0.7.9	YOSHIOKA Takuma <nop_thread@nops.red>	https://github.com/lo48576/iri-string	Apache-2.0 OR MIT		IRI as string types
itoa	1.0.15	David Tolnay <dtolnay@gmail.com>	https://github.com/dtolnay/itoa	Apache-2.0 OR MIT		Fast integer primitive to string conversion
